{
	"$schema": "https://raw.githubusercontent.com/Bedrock-OSS/regolith-schemas/main/config/v1.2.json",
	"name": "exe_filter_test_project",
	"author": "Bedrock-OSS",
	"packs": {
		"behaviorPack": "./packs/BP",
		"resourcePack": "./packs/RP"
	},
	"regolith": {
		"profiles": {
			"dev": {
				"filters": [
					{
						"filter": "test_exe_filter"
					}
				],
				"export": {
					"target": "local",
					"readOnly": false
				}
			}
		},
		"filterDefinitions": {
			"test_exe_filter": {
				"runWith": "exe",
				"exe": "./executables/test_exe_filter"
			}
		},
		"dataPath": "./packs/data"
	}
}