{
	"$schema": "https://raw.githubusercontent.com/Bedrock-OSS/regolith-schemas/main/config/v1.7.json",
	"author": "Your name",
	"name": "Project name",
	"packs": {
		"behaviorPack": "./packs/BP",
		"resourcePack": "./packs/RP"
	},
	"regolith": {
		"dataPath": "./packs/data",
		"filterDefinitions": {
			"hello-version-python-filter": {
				"url": "github.com/Bedrock-OSS/regolith-test-filters",
				"version": "TEST_TAG_1"
			}
		},
		"formatVersion": "1.7.0",
		"profiles": {
			"default": {
				"export": {
					"build": "standard",
					"readOnly": false,
					"target": "development"
				},
				"filters": []
			}
		}
	}
}