{
	"$schema": "https://raw.githubusercontent.com/Bedrock-OSS/regolith-schemas/main/config/unified.json",
	"author": "Your name",
	"name": "Project name",
	"packs": {
		"behaviorPack": "./packs/BP",
		"resourcePack": "./packs/RP"
	},
	"regolith": {
		"dataPath": "./packs/data",
		"filterDefinitions": {},
		"formatVersion": "1.8.0",
		"profiles": {
			"default": {
				"export": {
					"build": "standard",
					"readOnly": false,
					"target": "development"
				},
				"filters": []
			}
		}
	}
}