{
	"$schema": "https://raw.githubusercontent.com/Bedrock-OSS/regolith-schemas/main/config/v1.4.json",
	"author": "Your name",
	"name": "Project name",
	"packs": {
		"behaviorPack": "./packs/BP",
		"resourcePack": "./packs/RP"
	},
	"regolith": {
		"dataPath": "./packs/data",
		"filterDefinitions": {},
		"formatVersion": "1.4.0",
		"profiles": {
			"default": {
				"export": {
					"target": "local"
				},
				"filters": []
			}
		}
	}
}
