{
	"$schema": "https://raw.githubusercontent.com/Bedrock-OSS/regolith-schemas/main/config/v1.2.json",
	"author": "Your name",
	"name": "Project name",
	"packs": {
		"behaviorPack": "./packs/BP",
		"resourcePack": "./packs/RP"
	},
	"regolith": {
		"dataPath": "./packs/data",
		"filterDefinitions": {
			"test_filter": {
				"runWith": "python",
				"script": "local_filters/test_filter.py"
			}
		},
		"profiles": {
			"default": {
				"export": {
					"readOnly": false,
					"target": "development"
				},
				"filters": []
			}
		}
	}
}
