{
	"$schema": "https://raw.githubusercontent.com/Bedrock-OSS/regolith-schemas/main/config/v1.2.json",
	"name": "regolith_test_project",
	"author": "Bedrock-OSS",
	"packs": {
		"behaviorPack": "./packs/BP",
		"resourcePack": "./packs/RP"
	},
	"regolith": {
		"dataPath": "./packs/data",
		"filterDefinitions": {
			"nested-remote-filter": {
				"url": "github.com/Bedrock-OSS/regolith-test-filters",
				"version": "6230216184232e5bc7439caaf20cdd4c0dc17ca2"
			}
		},
		"profiles": {
			"dev": {
				"filters": [
					{
						"filter": "nested-remote-filter"
					}
				],
				"export": {
					"target": "development"
				}
			}
		}
	}
}