{
	"$schema": "https://raw.githubusercontent.com/Bedrock-OSS/regolith-schemas/main/config/v1.2.json",
	"name": "regolith_test_project",
	"author": "Bedrock-OSS",
	"packs": {
		"behaviorPack": "./packs/BP",
		"resourcePack": "./packs/RP"
	},
	"regolith": {
		"profiles": {
			"default": {
				"filters": [],
				"export": {
					"target": "local"
				}
			}
		},
		"dataPath": "./packs/data",
		"filterDefinitions": {}
	}
}